{"artifact_bytes":{"facts":{"gzip":1041,"raw":3333},"m01_distributions":{"gzip":2774,"raw":6987},"m02_sampling":{"gzip":6885,"raw":12912},"m03_montecarlo":{"gzip":7934,"raw":23334},"m04_bayes":{"gzip":4450,"raw":12216},"m05_forecast":{"gzip":4971,"raw":11559},"m06_credit":{"gzip":4474,"raw":14961},"m07_pareto":{"gzip":3600,"raw":8602},"m08_sensitivity":{"gzip":2431,"raw":6638},"m09_counterfactual":{"gzip":2401,"raw":8368},"m10_causal":{"gzip":2807,"raw":6526},"meta":{"gzip":2195,"raw":4876},"validation":{"gzip":2966,"raw":10310}},"artifacts":["m01_distributions.json","m02_sampling.json","m03_montecarlo.json","m04_bayes.json","m05_forecast.json","m06_credit.json","m07_pareto.json","m08_sensitivity.json","m09_counterfactual.json","m10_causal.json","meta.json","facts.json","validation.json"],"citations":["LaLonde, R. (1986). Evaluating the Econometric Evaluations of Training Programs. AER 76, 604-620.","Dehejia, R. and Wahba, S. (1999). Causal Effects in Non-Experimental Studies. JASA 94(448), 1053-1062.","Dehejia, R. and Wahba, S. (2002). Propensity Score Matching Methods for Non-Experimental Causal Studies. REStat 84, 151-161.","NBER data page: https://users.nber.org/~rdehejia/nswdata2.html","Hofmann, H. (1994). Statlog (German Credit Data). UCI Machine Learning Repository. https://doi.org/10.24432/C5NC77 (CC BY 4.0)","Ishigami, T. and Homma, T. (1990). An importance quantification technique in uncertainty analysis for computer models. IEEE ISUMA.","Saltelli, A. et al. (2008). Global Sensitivity Analysis: The Primer. Wiley.","Blackman, D. and Vigna, S. (2018). Scrambled linear pseudorandom number generators (xoshiro128**)."],"environment":{"platform":"Darwin","python":"3.12.13"},"generated_at":"2026-10-11T00:00:00Z","licence_note":"NSW/PSID data are distributed by NBER for attributable non-commercial use (CC by NC). This non-monetized portfolio publishes derived results only and never the raw or row-level data. German Credit is CC BY 4.0.","limitations":["Seeded environments are SYNTHETIC and illustrate method, not any real project, series or population.","NSW results come from one small volunteer sample (445 rows); PSID estimators depend heavily on specification.","The German Credit test split has 250 rows, so the empirical optimal threshold is noisy; the repeated-split table shows the spread.","Counterfactuals are model counterfactuals, not causal.","The forecast coverage study and bootstraps are precomputed (numpy PCG64), not reproduced in the browser."],"modules":[{"artifact":"m01_distributions.json","id":"m01","name":"Distributions","reference":"Lanczos lgamma, incomplete gamma/beta (Press et al., Numerical Recipes style); Acklam normal quantile","tag":"DERIVED"},{"artifact":"m02_sampling.json","id":"m02","name":"Sampling","reference":"xoshiro128** (Blackman and Vigna 2018), splitmix32 seeding","tag":"SYNTHETIC"},{"artifact":"m03_montecarlo.json","id":"m03","name":"Monte Carlo","reference":"seeded project-NPV environment","tag":"SYNTHETIC"},{"artifact":"m04_bayes.json","id":"m04","name":"Conjugate Bayes","reference":"beta-binomial, normal-normal; Wilson 1927","tag":"SYNTHETIC"},{"artifact":"m05_forecast.json","id":"m05","name":"Forecast intervals","reference":"SES (ETS A,N,N), AR(1) by OLS","tag":"SYNTHETIC/PREDICTED"},{"artifact":"m06_credit.json","id":"m06","name":"Cost-sensitive thresholds","reference":"UCI Statlog German Credit, cost matrix 5:1","tag":"OBSERVED/PREDICTED"},{"artifact":"m07_pareto.json","id":"m07","name":"LP and Pareto","reference":"epsilon-constraint, HiGHS","tag":"SYNTHETIC/DERIVED"},{"artifact":"m08_sensitivity.json","id":"m08","name":"Sensitivity","reference":"Ishigami; Saltelli 2010, Jansen 1999","tag":"DERIVED"},{"artifact":"m09_counterfactual.json","id":"m09","name":"Counterfactuals","reference":"model counterfactual search (not causal)","tag":"OBSERVED/PREDICTED"},{"artifact":"m10_causal.json","id":"m10","name":"Causal","reference":"NSW vs PSID; LaLonde 1986, Dehejia and Wahba 1999, 2002","tag":"OBSERVED/DERIVED"}],"project":"decision-universe","schema_version":"v1","seed":20261011,"sources":[{"bytes":28598,"id":"nsw_dw.dta","licence":"CC by NC (attributable non-commercial use)","md5":"e3367ddd449e25cb4c54c04263978800","name":"nsw_dw.dta","retrieved_at_utc":"2026-10-11T06:52:56+00:00","sha256":"d1bd2680a1c6f799f1c6d2455bf29633fdf19be01cb19490621c20a560b4e072","tag":"OBSERVED","url":"https://users.nber.org/~rdehejia/data/nsw_dw.dta","use":"module 10 experimental benchmark"},{"bytes":111458,"id":"psid_controls.dta","licence":"CC by NC (attributable non-commercial use)","md5":"1ae3ab3bc7c40048f41b0953a5e634f8","name":"psid_controls.dta","retrieved_at_utc":"2026-10-11T06:52:56+00:00","sha256":"7beebae8928035d6abf662b994ce77a4fbea7ae6575037ff94e92fe099b43e14","tag":"OBSERVED","url":"https://users.nber.org/~rdehejia/data/psid_controls.dta","use":"module 10 observational comparison group"},{"bytes":79793,"id":"german.data","licence":"CC BY 4.0","md5":"6b94c2e35480e671545e52a808a8a549","name":"german.data","retrieved_at_utc":"2026-10-11T06:52:56+00:00","sha256":"b21f3d81db8071257d5ff1deaeba1fd4303b62712e6fcc9715c7a86202cb5871","tag":"OBSERVED","url":"https://archive.ics.uci.edu/static/public/144/statlog+german+credit+data.zip#german.data","use":"modules 6 and 9"}],"tagline":"Every Decision Creates a Different Future","tags":{"modules":"DERIVED","sources":"OBSERVED"}}